{
  "version": "1.0",
  "eventId": "33333333-3333-4333-8333-333333333333",
  "executionId": "44444444-4444-4444-8444-444444444444",
  "jobId": "11111111-1111-4111-8111-111111111111",
  "correlationId": "aaaaaaaa-aaaa-4aaa-8aaa-aaaaaaaaaaaa",
  "source": "WORKER",
  "eventType": "PROGRESS",
  "occurredAt": "2026-08-20T20:00:01Z",
  "sequence": 2,
  "data": {
    "progressPercent": 50,
    "messageCode": "RHIA_ENTITY_EVIDENCE_COLLECTED",
    "attempt": 1
  }
}
